{
  "version": 1,
  "title": "Neon Breath — Nu-Disco Synthwave Study",
  "description": "10-synth four-bar original loop inspired by retro disco production; separate drum parts.",
  "tempo_bpm": 121,
  "time_signature": [
    4,
    4
  ],
  "bars": 4,
  "ticks_per_beat": 480,
  "timing": {
    "mode": "strict",
    "grid_division": 16
  },
  "key_signature": "Cm",
  "sections": [
    {
      "name": "Cm",
      "start": 0
    },
    {
      "name": "Fm",
      "start": 4
    },
    {
      "name": "Ab",
      "start": 8
    },
    {
      "name": "Bb",
      "start": 12
    }
  ],
  "assumptions": [
    "Four-bar complete loop/study explicitly requested, not full-length song; 121 BPM, Cm, 4/4, straight 1/16, 480 PPQN.",
    "All human note labels in producer README use Cubase C3=MIDI60; raw numeric MIDI pitches are authoritative.",
    "User approved sub C0/F0/Ab0/Bb0, numerical 24/29/32/34, to keep 30-80 Hz register.",
    "Cm7/Fm7/Abmaj7 harmonic colors; bar4 stab Bb/G upper voicing (G Bb D F) above Bb sub behaves as Bb6, not a changed bass progression.",
    "Pad uses whole-note chords each bar with common-tone ties; holding a single chord for all four bars would conflict with the requested progression.",
    "Layer10 is a polyphonic dual gesture preset distinguished by velocity1/127; small carrier leakage at riser velocity1 is possible, no hard switch.",
    "Direct triangle Sub bypasses internal lowpass and FX; mandatory DAW lowpass80 Hz and real kick sidechain described in README.",
    "Native quarter-note amplitude LFO is pumping, not detection of kick audio. Real sidechain is a host insert; native PUMP macro can be set to0.",
    "Stereo delay native times are 1/8 L and 1/16 R at121 BPM. Ping-pong mode and pitched shimmer require UI verification/manual steps.",
    "Drums per file trigger MIDI60/channel10 for separate Cubase Sampler Tracks. User selects concrete samples; none copied.",
    "No randomization, no combined MIDI, no rendered audio requested. Native preset loading and listening remain untested."
  ],
  "layers": [
    {
      "id": "layer01-sub-bass",
      "name": "01 Sub Bass",
      "role": "low-end foundation",
      "kind": "melodic",
      "volume": 99,
      "pan": 64,
      "notes": [
        {
          "pitch": 24,
          "start": 0.0,
          "duration": 4.0,
          "velocity": 100
        },
        {
          "pitch": 29,
          "start": 4.0,
          "duration": 4.0,
          "velocity": 100
        },
        {
          "pitch": 32,
          "start": 8.0,
          "duration": 4.0,
          "velocity": 100
        },
        {
          "pitch": 34,
          "start": 12.0,
          "duration": 4.0,
          "velocity": 100
        }
      ],
      "program": 80
    },
    {
      "id": "layer02-octave-bass",
      "name": "02 Moroder Octave Bass",
      "role": "rhythmic bass",
      "kind": "melodic",
      "volume": 95,
      "pan": 64,
      "notes": [
        {
          "pitch": 36,
          "start": 0.0,
          "duration": 0.18,
          "velocity": 108
        },
        {
          "pitch": 48,
          "start": 0.25,
          "duration": 0.18,
          "velocity": 84
        },
        {
          "pitch": 36,
          "start": 0.5,
          "duration": 0.18,
          "velocity": 94
        },
        {
          "pitch": 48,
          "start": 0.75,
          "duration": 0.18,
          "velocity": 82
        },
        {
          "pitch": 36,
          "start": 1.0,
          "duration": 0.18,
          "velocity": 108
        },
        {
          "pitch": 48,
          "start": 1.25,
          "duration": 0.18,
          "velocity": 84
        },
        {
          "pitch": 36,
          "start": 1.5,
          "duration": 0.18,
          "velocity": 94
        },
        {
          "pitch": 48,
          "start": 1.75,
          "duration": 0.18,
          "velocity": 82
        },
        {
          "pitch": 36,
          "start": 2.0,
          "duration": 0.18,
          "velocity": 108
        },
        {
          "pitch": 48,
          "start": 2.25,
          "duration": 0.18,
          "velocity": 84
        },
        {
          "pitch": 36,
          "start": 2.5,
          "duration": 0.18,
          "velocity": 94
        },
        {
          "pitch": 48,
          "start": 2.75,
          "duration": 0.18,
          "velocity": 82
        },
        {
          "pitch": 36,
          "start": 3.0,
          "duration": 0.18,
          "velocity": 108
        },
        {
          "pitch": 48,
          "start": 3.25,
          "duration": 0.18,
          "velocity": 84
        },
        {
          "pitch": 36,
          "start": 3.5,
          "duration": 0.18,
          "velocity": 94
        },
        {
          "pitch": 48,
          "start": 3.75,
          "duration": 0.18,
          "velocity": 82
        },
        {
          "pitch": 29,
          "start": 4.0,
          "duration": 0.18,
          "velocity": 108
        },
        {
          "pitch": 41,
          "start": 4.25,
          "duration": 0.18,
          "velocity": 84
        },
        {
          "pitch": 29,
          "start": 4.5,
          "duration": 0.18,
          "velocity": 94
        },
        {
          "pitch": 41,
          "start": 4.75,
          "duration": 0.18,
          "velocity": 82
        },
        {
          "pitch": 29,
          "start": 5.0,
          "duration": 0.18,
          "velocity": 108
        },
        {
          "pitch": 41,
          "start": 5.25,
          "duration": 0.18,
          "velocity": 84
        },
        {
          "pitch": 29,
          "start": 5.5,
          "duration": 0.18,
          "velocity": 94
        },
        {
          "pitch": 41,
          "start": 5.75,
          "duration": 0.18,
          "velocity": 82
        },
        {
          "pitch": 29,
          "start": 6.0,
          "duration": 0.18,
          "velocity": 108
        },
        {
          "pitch": 41,
          "start": 6.25,
          "duration": 0.18,
          "velocity": 84
        },
        {
          "pitch": 29,
          "start": 6.5,
          "duration": 0.18,
          "velocity": 94
        },
        {
          "pitch": 41,
          "start": 6.75,
          "duration": 0.18,
          "velocity": 82
        },
        {
          "pitch": 29,
          "start": 7.0,
          "duration": 0.18,
          "velocity": 108
        },
        {
          "pitch": 41,
          "start": 7.25,
          "duration": 0.18,
          "velocity": 84
        },
        {
          "pitch": 29,
          "start": 7.5,
          "duration": 0.18,
          "velocity": 94
        },
        {
          "pitch": 41,
          "start": 7.75,
          "duration": 0.18,
          "velocity": 82
        },
        {
          "pitch": 32,
          "start": 8.0,
          "duration": 0.18,
          "velocity": 108
        },
        {
          "pitch": 44,
          "start": 8.25,
          "duration": 0.18,
          "velocity": 84
        },
        {
          "pitch": 32,
          "start": 8.5,
          "duration": 0.18,
          "velocity": 94
        },
        {
          "pitch": 44,
          "start": 8.75,
          "duration": 0.18,
          "velocity": 82
        },
        {
          "pitch": 32,
          "start": 9.0,
          "duration": 0.18,
          "velocity": 108
        },
        {
          "pitch": 44,
          "start": 9.25,
          "duration": 0.18,
          "velocity": 84
        },
        {
          "pitch": 32,
          "start": 9.5,
          "duration": 0.18,
          "velocity": 94
        },
        {
          "pitch": 44,
          "start": 9.75,
          "duration": 0.18,
          "velocity": 82
        },
        {
          "pitch": 32,
          "start": 10.0,
          "duration": 0.18,
          "velocity": 108
        },
        {
          "pitch": 44,
          "start": 10.25,
          "duration": 0.18,
          "velocity": 84
        },
        {
          "pitch": 32,
          "start": 10.5,
          "duration": 0.18,
          "velocity": 94
        },
        {
          "pitch": 44,
          "start": 10.75,
          "duration": 0.18,
          "velocity": 82
        },
        {
          "pitch": 32,
          "start": 11.0,
          "duration": 0.18,
          "velocity": 108
        },
        {
          "pitch": 44,
          "start": 11.25,
          "duration": 0.18,
          "velocity": 84
        },
        {
          "pitch": 32,
          "start": 11.5,
          "duration": 0.18,
          "velocity": 94
        },
        {
          "pitch": 44,
          "start": 11.75,
          "duration": 0.18,
          "velocity": 82
        },
        {
          "pitch": 34,
          "start": 12.0,
          "duration": 0.18,
          "velocity": 108
        },
        {
          "pitch": 46,
          "start": 12.25,
          "duration": 0.18,
          "velocity": 84
        },
        {
          "pitch": 34,
          "start": 12.5,
          "duration": 0.18,
          "velocity": 94
        },
        {
          "pitch": 46,
          "start": 12.75,
          "duration": 0.18,
          "velocity": 82
        },
        {
          "pitch": 34,
          "start": 13.0,
          "duration": 0.18,
          "velocity": 108
        },
        {
          "pitch": 46,
          "start": 13.25,
          "duration": 0.18,
          "velocity": 84
        },
        {
          "pitch": 34,
          "start": 13.5,
          "duration": 0.18,
          "velocity": 94
        },
        {
          "pitch": 46,
          "start": 13.75,
          "duration": 0.18,
          "velocity": 82
        },
        {
          "pitch": 34,
          "start": 14.0,
          "duration": 0.18,
          "velocity": 108
        },
        {
          "pitch": 46,
          "start": 14.25,